{"name":"MASI-NIDS Analysis Agent","description":"Grounded and non-executable security evidence analysis.","url":"https://analysis.masi.internal","protocolVersion":"1.0","preferredTransport":"HTTP+JSON","version":"1.0.0","capabilities":{"streaming":false,"pushNotifications":false,"stateTransitionHistory":true},"defaultInputModes":["application/json"],"defaultOutputModes":["application/json"],"skills":[{"id":"analyze_nids_incident","name":"Analyze Nids Incident","description":"Bounded qualified Analysis skill.","inputModes":["application/json"],"outputModes":["application/json"]},{"id":"compare_event_windows","name":"Compare Event Windows","description":"Bounded qualified Analysis skill.","inputModes":["application/json"],"outputModes":["application/json"]},{"id":"draft_mitigation_advice","name":"Draft Mitigation Advice","description":"Bounded qualified Analysis skill.","inputModes":["application/json"],"outputModes":["application/json"]},{"id":"generate_incident_content","name":"Generate Incident Content","description":"Bounded qualified Analysis skill.","inputModes":["application/json"],"outputModes":["application/json"]}],"security":{"scheme":"mutualTLS","mtlsRequired":true,"dynamicDiscovery":false}}
